{
 "id": "scd-plaza-egana",
 "nombre": "Teatro SCD Plaza Egaña",
 "ciudad": "Santiago",
 "comuna": "Ñuñoa",
 "tipo": "teatro",
 "publico": true,
 "fecha_captura": "2026-07-30",
 "fuente_datos": "documento",
 "licencia": "ODbL-1.0",
 "notas": "DEMO. La geometría de este archivo está DERIVADA del generador de referencia tools/venue2d/referencia_plano_teatro.py (v3.4, valores por defecto), no de una visita con instrumento: nadie la firma y ninguna cota se levantó en sala. Sirve para que el visor 3D tenga material real de trabajo y para mostrar cómo se dibuja cada nivel de confianza. Pendiente: cotas reales. Cuando existan, este archivo se reemplaza entero.",
 "escenario": {
  "ancho": {
   "m": 10.0,
   "confianza": "aportado",
   "metodo": "cotas fijas del generador de referencia v3.4"
  },
  "profundidad": {
   "m": 4.5,
   "confianza": "aportado",
   "metodo": "cotas fijas del generador de referencia v3.4"
  }
 },
 "proyeccion": {
  "superficie": "desconocido",
  "notas": "sin datos: el plano de referencia es una planta, no dice nada de proyección."
 },
 "residuos": [
  {
   "descripcion": "El plano de referencia es una PLANTA: ninguna altura está medida. Muros (6,00 m), balcón (3,20 m) y baranda (1,00 m) son supuestos y van marcados no_verificado.",
   "magnitud_m": 6.0
  },
  {
   "descripcion": "La sala se dibuja plana: la pendiente de la platea y la altura del escenario sobre el piso no se midieron, así que el modelo las deja en cero en vez de inventarlas."
  },
  {
   "descripcion": "Los muros laterales son radiales, así que la sala se abre hacia el fondo más de lo que se abre una sala real. Es el modelo del generador, no una medición del recinto."
  }
 ],
 "geometria": {
  "unidad": "m",
  "nota": "DEMO derivada del generador de referencia v3.4 (radio 14.339 m, centro virtual en y=-9.839 m). La confianza por polilínea es real en su criterio y demostrativa en su origen: escenario = cotas fijas del generador, butacas = modelo radial, todo lo que tiene altura = suposición. 56 polilíneas, 503 aristas, 293 butacas en el modelo.",
  "polilineas": [
   {
    "puntos": [
     [
      -5.0,
      0.0,
      0.0
     ],
     [
      5.0,
      0.0,
      0.0
     ]
    ],
    "confianza": "medido",
    "etiqueta": "fondo de escenario · cuerda 10,00 m",
    "capa": "escenario",
    "metodo": "cotas fijas del generador de referencia v3.4"
   },
   {
    "puntos": [
     [
      -5.0,
      0.0,
      0.0
     ],
     [
      -5.0,
      3.6,
      0.0
     ]
    ],
    "confianza": "medido",
    "etiqueta": "hombro izquierdo · 3,60 m",
    "capa": "escenario",
    "metodo": "cotas fijas del generador de referencia v3.4"
   },
   {
    "puntos": [
     [
      5.0,
      0.0,
      0.0
     ],
     [
      5.0,
      3.6,
      0.0
     ]
    ],
    "confianza": "medido",
    "etiqueta": "hombro derecho · 3,60 m",
    "capa": "escenario",
    "metodo": "cotas fijas del generador de referencia v3.4"
   },
   {
    "puntos": [
     [
      -5.0,
      3.6,
      0.0
     ],
     [
      -4.599,
      3.742,
      0.0
     ],
     [
      -4.194,
      3.873,
      0.0
     ],
     [
      -3.785,
      3.991,
      0.0
     ],
     [
      -3.373,
      4.098,
      0.0
     ],
     [
      -2.958,
      4.192,
      0.0
     ],
     [
      -2.54,
      4.273,
      0.0
     ],
     [
      -2.12,
      4.342,
      0.0
     ],
     [
      -1.698,
      4.399,
      0.0
     ],
     [
      -1.275,
      4.443,
      0.0
     ],
     [
      -0.851,
      4.475,
      0.0
     ],
     [
      -0.426,
      4.494,
      0.0
     ],
     [
      0.0,
      4.5,
      0.0
     ],
     [
      0.426,
      4.494,
      0.0
     ],
     [
      0.851,
      4.475,
      0.0
     ],
     [
      1.275,
      4.443,
      0.0
     ],
     [
      1.698,
      4.399,
      0.0
     ],
     [
      2.12,
      4.342,
      0.0
     ],
     [
      2.54,
      4.273,
      0.0
     ],
     [
      2.958,
      4.192,
      0.0
     ],
     [
      3.373,
      4.098,
      0.0
     ],
     [
      3.785,
      3.991,
      0.0
     ],
     [
      4.194,
      3.873,
      0.0
     ],
     [
      4.599,
      3.742,
      0.0
     ],
     [
      5.0,
      3.6,
      0.0
     ]
    ],
    "confianza": "medido",
    "etiqueta": "linea de boca · sagita 0,90 m sobre 3,60 m",
    "capa": "escenario",
    "metodo": "cotas fijas del generador de referencia v3.4"
   },
   {
    "puntos": [
     [
      -5.0,
      3.6,
      0.0
     ],
     [
      5.0,
      3.6,
      0.0
     ]
    ],
    "confianza": "medido",
    "etiqueta": "linea recta de boca",
    "capa": "escenario",
    "metodo": "cotas fijas del generador de referencia v3.4"
   },
   {
    "puntos": [
     [
      -6.25,
      3.6,
      0.0
     ],
     [
      -7.25,
      3.6,
      0.0
     ],
     [
      -7.25,
      -1.4,
      0.0
     ]
    ],
    "confianza": "ajustado",
    "etiqueta": "pasillo backstage",
    "capa": "backstage",
    "metodo": "derivado del modelo radial (cuerda/sagita)"
   },
   {
    "puntos": [
     [
      6.25,
      3.6,
      0.0
     ],
     [
      7.25,
      3.6,
      0.0
     ],
     [
      7.25,
      -1.4,
      0.0
     ]
    ],
    "confianza": "ajustado",
    "etiqueta": "pasillo backstage",
    "capa": "backstage",
    "metodo": "derivado del modelo radial (cuerda/sagita)"
   },
   {
    "puntos": [
     [
      -7.25,
      -1.4,
      0.0
     ],
     [
      7.25,
      -1.4,
      0.0
     ]
    ],
    "confianza": "ajustado",
    "etiqueta": "cierre trasero backstage",
    "capa": "backstage",
    "metodo": "derivado del modelo radial (cuerda/sagita)"
   },
   {
    "puntos": [
     [
      -4.141,
      6.214,
      0.0
     ],
     [
      -3.12,
      6.444,
      0.0
     ],
     [
      -2.087,
      6.608,
      0.0
     ],
     [
      -1.046,
      6.707,
      0.0
     ],
     [
      0.0,
      6.74,
      0.0
     ],
     [
      1.046,
      6.707,
      0.0
     ],
     [
      2.087,
      6.608,
      0.0
     ],
     [
      3.12,
      6.444,
      0.0
     ],
     [
      4.141,
      6.214,
      0.0
     ],
     [
      4.021,
      5.75,
      0.0
     ],
     [
      3.03,
      5.972,
      0.0
     ],
     [
      2.027,
      6.132,
      0.0
     ],
     [
      1.015,
      6.228,
      0.0
     ],
     [
      0.0,
      6.26,
      0.0
     ],
     [
      -1.015,
      6.228,
      0.0
     ],
     [
      -2.027,
      6.132,
      0.0
     ],
     [
      -3.03,
      5.972,
      0.0
     ],
     [
      -4.021,
      5.75,
      0.0
     ],
     [
      -4.141,
      6.214,
      0.0
     ]
    ],
    "confianza": "ajustado",
    "etiqueta": "F1 centro · 15 butacas",
    "capa": "butacas",
    "metodo": "derivado del modelo radial (cuerda/sagita)"
   },
   {
    "puntos": [
     [
      5.021,
      5.962,
      0.0
     ],
     [
      6.072,
      5.588,
      0.0
     ],
     [
      7.096,
      5.145,
      0.0
     ],
     [
      6.891,
      4.711,
      0.0
     ],
     [
      5.896,
      5.141,
      0.0
     ],
     [
      4.875,
      5.504,
      0.0
     ],
     [
      5.021,
      5.962,
      0.0
     ]
    ],
    "confianza": "ajustado",
    "etiqueta": "F1 derecha · 4 butacas",
    "capa": "butacas",
    "metodo": "derivado del modelo radial (cuerda/sagita)"
   },
   {
    "puntos": [
     [
      -7.096,
      5.145,
      0.0
     ],
     [
      -6.072,
      5.588,
      0.0
     ],
     [
      -5.021,
      5.962,
      0.0
     ],
     [
      -4.875,
      5.504,
      0.0
     ],
     [
      -5.896,
      5.141,
      0.0
     ],
     [
      -6.891,
      4.711,
      0.0
     ],
     [
      -7.096,
      5.145,
      0.0
     ]
    ],
    "confianza": "ajustado",
    "etiqueta": "F1 izquierda · 4 butacas",
    "capa": "butacas",
    "metodo": "derivado del modelo radial (cuerda/sagita)"
   },
   {
    "puntos": [
     [
      -4.413,
      7.074,
      0.0
     ],
     [
      -3.326,
      7.321,
      0.0
     ],
     [
      -2.225,
      7.498,
      0.0
     ],
     [
      -1.115,
      7.604,
      0.0
     ],
     [
      0.0,
      7.64,
      0.0
     ],
     [
      1.115,
      7.604,
      0.0
     ],
     [
      2.225,
      7.498,
      0.0
     ],
     [
      3.326,
      7.321,
      0.0
     ],
     [
      4.413,
      7.074,
      0.0
     ],
     [
      4.292,
      6.609,
      0.0
     ],
     [
      3.234,
      6.849,
      0.0
     ],
     [
      2.163,
      7.022,
      0.0
     ],
     [
      1.084,
      7.125,
      0.0
     ],
     [
      0.0,
      7.16,
      0.0
     ],
     [
      -1.084,
      7.125,
      0.0
     ],
     [
      -2.163,
      7.022,
      0.0
     ],
     [
      -3.234,
      6.849,
      0.0
     ],
     [
      -4.292,
      6.609,
      0.0
     ],
     [
      -4.413,
      7.074,
      0.0
     ]
    ],
    "confianza": "ajustado",
    "etiqueta": "F2 centro · 16 butacas",
    "capa": "butacas",
    "metodo": "derivado del modelo radial (cuerda/sagita)"
   },
   {
    "puntos": [
     [
      5.339,
      6.805,
      0.0
     ],
     [
      6.39,
      6.43,
      0.0
     ],
     [
      7.414,
      5.99,
      0.0
     ],
     [
      7.211,
      5.555,
      0.0
     ],
     [
      6.214,
      5.983,
      0.0
     ],
     [
      5.193,
      6.347,
      0.0
     ],
     [
      5.339,
      6.805,
      0.0
     ]
    ],
    "confianza": "ajustado",
    "etiqueta": "F2 derecha · 4 butacas",
    "capa": "butacas",
    "metodo": "derivado del modelo radial (cuerda/sagita)"
   },
   {
    "puntos": [
     [
      -7.414,
      5.99,
      0.0
     ],
     [
      -6.39,
      6.43,
      0.0
     ],
     [
      -5.339,
      6.805,
      0.0
     ],
     [
      -5.193,
      6.347,
      0.0
     ],
     [
      -6.214,
      5.983,
      0.0
     ],
     [
      -7.211,
      5.555,
      0.0
     ],
     [
      -7.414,
      5.99,
      0.0
     ]
    ],